Sentence ID,Sentence,Valence,Arousal,Dominance,Sentiment Label,Average VAD,# Words Found,Found Words,All Words
1,"Ses05F_impro01_F000 [003.6132-006.1700]: Hi, I need an ID.",5.475,3.3049999999999997,5.21,neutral,4.663333333333333,2 out of 3,"['need', 'id']","['hi', 'need', 'id']"
2,"Ses05F_impro01_M000 [005.7800-014.7800]: ahh Yeah, this is the wrong line.",4.03,4.265000000000001,4.14,neutral,4.1450000000000005,2 out of 4,"['wrong', 'line']","['ahh', 'yeah', 'wrong', 'line']"
3,I'm sorry.,4.81,4.62,5.65,neutral,5.026666666666666,1 out of 1,['sorry'],['sorry']
4,You need to go back over to line two B.,5.53,3.5380000000000003,5.109999999999999,neutral,4.726,5 out of 5,"['need', 'go', 'back', 'line', 'two']","['need', 'go', 'back', 'line', 'two']"
5,That's where you should have started from.,6.41,4.81,5.5,positive,5.573333333333333,1 out of 1,['start'],['start']
6,Ses05F_impro01_FXX0 [013.0388-013.8112]: No.,nan,nan,nan,nan,nan,0,nan,[]
7,"Ses05F_impro01_F001 [014.1500-019.4900]: Okay, I'm sorry, but I just stood in this line for an hour.",4.9875,3.585,5.67,neutral,4.7475,4 out of 5,"['sorry', 'stand', 'line', 'hour']","['okay', 'sorry', 'stand', 'line', 'hour']"
8,can I Is there any way I can-,5.91,2.9,4.83,neutral,4.546666666666667,1 out of 1,['way'],['way']
9,"Ses05F_impro01_M001 [017.6400-024.1600]: I mean, there's really nothing I can do for you in this line.",3.625,4.025,4.529999999999999,negative,4.06,2 out of 4,"['mean', 'line']","['mean', 'really', 'nothing', 'line']"
10,This is not the line for new I.D.,6.43,5.949999999999999,5.165,positive,5.848333333333333,2 out of 2,"['neg-line', 'new']","['line', 'new']"
11,This is the line for registration.,4.805,3.165,5.105,neutral,4.358333333333333,2 out of 2,"['line', 'registration']","['line', 'registration']"
12,"Ses05F_impro01_F002 [022.8500-026.9000]: No, they told me-I'm sorry, but they told me to be in this line.",4.9075,4.465,5.135,neutral,4.8358333333333325,4 out of 4,"['neg-tell', 'sorry', 'tell', 'line']","['tell', 'sorry', 'tell', 'line']"
13,"Ses05F_impro01_M002 [026.6500-031.4800]: Yeah, I understand that ma'am.",6.68,3.52,6.71,positive,5.636666666666667,1 out of 2,['understand'],"['yeah', 'understand']"
14,"I don't know what they said to you, but you need to be in a different line.",5.054,4.41,5.504,neutral,4.989333333333334,5 out of 5,"['neg-know', 'say', 'need', 'different', 'line']","['know', 'say', 'need', 'different', 'line']"
15,"Ses05F_impro01_F003 [029.9800-034.4600]: What, I mean what... what's the difference?",3.66,3.9799999999999995,4.805,negative,4.148333333333333,2 out of 2,"['mean', 'difference']","['mean', 'difference']"
16,What do I need to do there that I can't do here?,5.45,3.67,5.06,neutral,4.726666666666667,1 out of 2,['need'],"['need', 'ca']"
17,"Ses05F_impro01_M003 [034.1100-040.8800]: Well, I have no camera here.",3.3899999999999997,6.95,3.6100000000000003,negative,4.6499999999999995,1 out of 2,['neg-camera'],"['well', 'camera']"
18,"I can't help you at all here, ma'am.",3.05,5.71,3.1100000000000003,negative,3.956666666666667,1 out of 2,['neg-help'],"['ca', 'help']"
19,I have forms for something completely different.,5.775,3.9000000000000004,6.47,neutral,5.381666666666667,2 out of 4,"['form', 'different']","['form', 'something', 'completely', 'different']"
20,You need to go to a different place.,5.885,4.0,5.8475,neutral,5.244166666666667,4 out of 4,"['need', 'go', 'different', 'place']","['need', 'go', 'different', 'place']"
21,Ses05F_impro01_F004 [039.4800-042.1800]: Can you just-can I just get the right-,6.705,4.335,6.405,positive,5.815,2 out of 2,"['get', 'right']","['get', 'right']"
22,"Ses05F_impro01_M004 [041.1100-044.3900]: Simply step to line two A, ma'am, I'm sorry.",5.4025,3.6675,5.3975,neutral,4.822500000000001,4 out of 5,"['step', 'line', 'two', 'sorry']","['simply', 'step', 'line', 'two', 'sorry']"
23,Ses05F_impro01_F005 [042.8400-045.7800]: Would you be able to put me at the front of that line?,5.615,3.5725,5.735,neutral,4.974166666666666,4 out of 5,"['would', 'able', 'put', 'line']","['would', 'able', 'put', 'front', 'line']"
24,Ses05F_impro01_M005 [044.4200-048.1600]: There is a large line of people behind you waiting to be--,5.21,3.995,5.1625,neutral,4.789166666666667,4 out of 5,"['large', 'line', 'people', 'wait']","['large', 'line', 'people', 'behind', 'wait']"
25,Ses05F_impro01_F006 [046.8200-053.7400]: I know.,6.82,3.24,5.78,positive,5.28,1 out of 1,['know'],['know']
26,I've been in line with these people.,5.26,3.505,5.145,neutral,4.636666666666667,2 out of 2,"['line', 'people']","['line', 'people']"
27,I understand.,6.68,3.52,6.71,positive,5.636666666666667,1 out of 1,['understand'],['understand']
28,I understand what it's like.,7.0600000000000005,3.96,6.495,positive,5.838333333333334,2 out of 2,"['understand', 'like']","['understand', 'like']"
29,Could you please like call over and-,6.8100000000000005,3.845,5.945,positive,5.533333333333334,2 out of 4,"['like', 'call']","['could', 'please', 'like', 'call']"
30,"Ses05F_impro01_M006 [052.1100-059.0900]: I don't want to be rude here, ma'am, but line two B is where you need to be.",4.522,3.93,4.6819999999999995,neutral,4.378,5 out of 6,"['neg-want', 'rude', 'line', 'two', 'need']","['want', 'rude', 'line', 'two', 'b', 'need']"
31,This is the line for registration.,4.805,3.165,5.105,neutral,4.358333333333333,2 out of 2,"['line', 'registration']","['line', 'registration']"
32,Ses05F_impro01_F007 [058.2800-065.3300]: I hear that.,6.68,3.62,6.71,positive,5.670000000000001,1 out of 1,['hear'],['hear']
33,I hear that.,6.68,3.62,6.71,positive,5.670000000000001,1 out of 1,['hear'],['hear']
34,"Thank you, but I've waited in line for so long, and I don't want to have to be here all day.",5.5,3.704,5.458,neutral,4.887333333333333,5 out of 6,"['thank', 'wait', 'line', 'neg-want', 'day']","['thank', 'wait', 'line', 'long', 'want', 'day']"
35,Ses05F_impro01_M007 [067.6900-069.3400]: I don't have those-,nan,nan,nan,nan,nan,0,nan,[]
36,"Ses05F_impro01_F008 [065.3400-069.5800]: So could I maybe get the form from you, fill it out here- and maybe you could-",5.763333333333333,3.6233333333333335,6.3,neutral,5.228888888888889,3 out of 7,"['get', 'form', 'fill']","['could', 'maybe', 'get', 'form', 'fill', 'maybe', 'could']"
37,"Ses05F_impro01_M008 [069.3700-074.3600]: I don't have those forms, ma'am.",4.36,6.15,3.5300000000000002,neutral,4.680000000000001,1 out of 1,['neg-form'],['form']
38,I can't help you.,3.05,5.71,3.1100000000000003,negative,3.956666666666667,1 out of 2,['neg-help'],"['ca', 'help']"
39,That's why you need to go to line two A.,5.7225,3.7750000000000004,5.0825,neutral,4.86,4 out of 4,"['need', 'go', 'line', 'two']","['need', 'go', 'line', 'two']"
40,Ses05F_impro01_F009 [074.0600-076.6800]: And how long is that going to take?,5.57,4.6899999999999995,5.08,neutral,5.113333333333333,2 out of 3,"['go', 'take']","['long', 'go', 'take']"
41,"Ses05F_impro01_M009 [076.1600-087.3000]: Ma'am, obviously I have no idea how long it's taking.",3.8850000000000002,4.93,4.359999999999999,negative,4.391666666666667,2 out of 4,"['neg-idea', 'take']","['obviously', 'idea', 'long', 'take']"
42,There seems to be a bit of a line there.,5.1066666666666665,3.4466666666666668,4.983333333333333,neutral,4.5122222222222215,3 out of 3,"['seem', 'bit', 'line']","['seem', 'bit', 'line']"
43,It looks like thirty forty people.,5.766,3.764,5.83,neutral,5.12,5 out of 5,"['look', 'like', 'thirty', 'forty', 'people']","['look', 'like', 'thirty', 'forty', 'people']"
44,It could take four to five hours.,5.1325,3.71,5.595000000000001,neutral,4.812500000000001,4 out of 5,"['take', 'four', 'five', 'hour']","['could', 'take', 'four', 'five', 'hour']"
45,I'm sorry.,4.81,4.62,5.65,neutral,5.026666666666666,1 out of 1,['sorry'],['sorry']
46,Ses05F_impro01_F010 [086.8900-088.5000]: I don't-,nan,nan,nan,nan,nan,0,nan,[]
47,"Ses05F_impro01_M010 [087.6000-089.6000]: There's nothing I can do for you, ma'am.",nan,nan,nan,nan,nan,0,nan,['nothing']
48,"Ses05F_impro01_F011 [088.5200-091.5428]: I don't have time for this today, and-",4.4,6.59,5.64,neutral,5.543333333333333,1 out of 2,['neg-time'],"['time', 'today']"
49,"Ses05F_impro01_M011 [091.3100-099.8800]: But, obviously I don't have time for you to stand here and waste my time in this line.",4.54,4.0760000000000005,5.072,neutral,4.562666666666666,5 out of 6,"['neg-time', 'stand', 'waste', 'time', 'line']","['obviously', 'time', 'stand', 'waste', 'time', 'line']"
50,There are other people who need service behind you who are waiting for the right things.,5.9,3.74,5.611666666666666,neutral,5.083888888888889,6 out of 7,"['people', 'need', 'service', 'wait', 'right', 'thing']","['people', 'need', 'service', 'behind', 'wait', 'right', 'thing']"
51,Ses05F_impro01_F012 [096.2500-101.6000]: Is there anything you can do?,nan,nan,nan,nan,nan,0,nan,['anything']
52,"Please, have some compassion.",7.9,4.5,6.36,positive,6.253333333333334,1 out of 2,['compassion'],"['please', 'compassion']"
53,Is there something you can do?,nan,nan,nan,nan,nan,0,nan,['something']
54,"Ses05F_impro01_M012 [100.5200-110.6000]: I am a very compassionate person, and I'm offended that you imply that I'm not.",5.5325,4.3125,5.4425,neutral,5.095833333333332,4 out of 4,"['compassionate', 'person', 'offend', 'imply']","['compassionate', 'person', 'offend', 'imply']"
55,"Of course, I'm compassionate.",7.95,4.73,6.86,positive,6.513333333333333,1 out of 2,['compassionate'],"['course', 'compassionate']"
56,"Look, I work in the D.M.V..  What do you think I am?",5.8933333333333335,3.9466666666666668,6.166666666666667,neutral,5.335555555555556,3 out of 3,"['look', 'work', 'think']","['look', 'work', 'think']"
57,Go wait in line two A.,5.4975000000000005,3.7625,5.145,neutral,4.801666666666667,4 out of 4,"['go', 'wait', 'line', 'two']","['go', 'wait', 'line', 'two']"
58,Ses05F_impro01_M013 [111.0800-118.4700]: Don't ask me to have somebody else come over here and move you myself.,4.88,4.776666666666666,4.923333333333334,neutral,4.86,3 out of 5,"['neg-ask', 'come', 'move']","['ask', 'somebody', 'else', 'come', 'move']"
59,I can't come back over there.,4.800000000000001,6.92,4.42,neutral,5.38,2 out of 3,"['neg-come', 'neg-back']","['ca', 'come', 'back']"
60,I'll get security if you need me to.,5.983333333333333,3.8433333333333333,5.57,neutral,5.1322222222222225,3 out of 3,"['get', 'security', 'need']","['get', 'security', 'need']"
61,"Ses05F_impro01_F013 [117.8600-128.7300]: Please, I don't think that's necessary.",4.355,4.8149999999999995,4.195,neutral,4.455,2 out of 3,"['neg-think', 'necessary']","['please', 'think', 'necessary']"
62,"I'm just asking, maybe you could call over and say that somebody miss informed her because I didn't pick to stand in this line.",5.12,4.36875,5.42,neutral,4.9695833333333335,8 out of 11,"['ask', 'call', 'say', 'miss', 'inform', 'neg-pick', 'neg-stand', 'line']","['ask', 'maybe', 'could', 'call', 'say', 'somebody', 'miss', 'inform', 'pick', 'stand', 'line']"
63,"I asked them where to stand, and they told me here.",5.496666666666666,3.48,5.706666666666667,neutral,4.894444444444445,3 out of 3,"['ask', 'stand', 'tell']","['ask', 'stand', 'tell']"
64,"Ses05F_impro01_M014 [127.9700-131.1100]: what, no, I'm sure they did not tell you here.",5.6850000000000005,4.8100000000000005,5.9399999999999995,neutral,5.478333333333334,2 out of 2,"['sure', 'neg-tell']","['sure', 'tell']"
65,"Ses05F_impro01_F014 [130.3000-134.7700]: No, they did.",nan,nan,nan,nan,nan,0,nan,[]
66,The lady over there told me to stand in this line and I've been here for an hour.,5.4639999999999995,3.526,5.568,neutral,4.852666666666666,5 out of 5,"['lady', 'tell', 'stand', 'line', 'hour']","['lady', 'tell', 'stand', 'line', 'hour']"
67,"Ses05F_impro01_M015 [132.1100-135.5000]: what The lady, what?",6.91,4.05,5.87,positive,5.61,1 out of 1,['lady'],['lady']
68,the janitor?,4.86,2.3,5.36,neutral,4.173333333333333,1 out of 1,['janitor'],['janitor']
69,Ses05F_impro01_F015 [135.3800-136.7300]: No.,nan,nan,nan,nan,nan,0,nan,[]
70,Ses05F_impro01_M016 [135.5400-140.0000]: You asked the janitor what line to stand in?,5.225,3.0300000000000002,5.6075,neutral,4.620833333333333,4 out of 4,"['ask', 'janitor', 'line', 'stand']","['ask', 'janitor', 'line', 'stand']"
71,"Obviously, that's not going to be the right thing.",5.516666666666667,4.523333333333333,5.746666666666667,neutral,5.2622222222222215,3 out of 4,"['neg-go', 'right', 'thing']","['obviously', 'go', 'right', 'thing']"
72,"Ses05F_impro01_F016 [136.7600-140.5500]: No, I'm not, I'm sorry.I'm not stupid.",7.16,5.66,5.97,positive,6.263333333333333,1 out of 1,['neg-stupid'],['stupid']
73,"Ses05F_impro01_M017 [140.1500-145.8800]: I'm not saying that you're stupid, ma'am.",3.465,4.955,3.575,negative,3.9983333333333335,2 out of 2,"['neg-say', 'stupid']","['say', 'stupid']"
74,I think you just said that you were stupid.,5.1433333333333335,4.173333333333333,5.803333333333334,neutral,5.04,3 out of 3,"['think', 'say', 'stupid']","['think', 'say', 'stupid']"
75,Ses05F_impro01_F017 [144.6800-150.7000]: Isn't there anything you can do?,nan,nan,nan,nan,nan,0,nan,['anything']
76,Just call over and ask them if I can go to the front of the line in the other line.,5.618,3.6220000000000003,5.402,neutral,4.8806666666666665,5 out of 6,"['call', 'ask', 'go', 'line', 'line']","['call', 'ask', 'go', 'front', 'line', 'line']"
77,"Ses05F_impro01_M018 [149.4200-151.6900]: It doesn't work that way here, ma'am.",4.52,6.385,4.525,neutral,5.1433333333333335,2 out of 2,"['neg-work', 'neg-way']","['work', 'way']"
78,Ses05F_impro01_F018 [150.9500-152.5100]: Why not?,nan,nan,nan,nan,nan,0,nan,[]
79,Ses05F_impro01_M019 [151.7151-157.7300]: There is a strict system here.,4.575,3.94,5.46,neutral,4.658333333333334,2 out of 2,"['strict', 'system']","['strict', 'system']"
80,You need to wait in the right line for the right thing.,5.835,3.993333333333333,5.831666666666667,neutral,5.22,6 out of 6,"['need', 'wait', 'right', 'line', 'right', 'thing']","['need', 'wait', 'right', 'line', 'right', 'thing']"
81,This is the line for registration.,4.805,3.165,5.105,neutral,4.358333333333333,2 out of 2,"['line', 'registration']","['line', 'registration']"
82,"Ses05F_impro01_F019 [154.9600-159.5500]: Except they're going tell, are you going to tell me the right line to stand in this time at least?",5.77375,4.02375,5.355,neutral,5.050833333333333,8 out of 10,"['go', 'tell', 'go', 'tell', 'right', 'line', 'stand', 'time']","['except', 'go', 'tell', 'go', 'tell', 'right', 'line', 'stand', 'time', 'least']"
83,Ses05F_impro01_M020 [158.4300-161.2200]: I told you it was line two A.,5.463333333333333,3.4766666666666666,4.96,neutral,4.633333333333333,3 out of 3,"['tell', 'line', 'two']","['tell', 'line', 'two']"
84,"Ses05F_impro01_F020 [160.0100-164.8200]: Right, well, last time they told me, it was this line, and obviously, it's not true.",5.1,4.106,4.87,neutral,4.692,5 out of 8,"['right', 'time', 'tell', 'line', 'neg-true']","['right', 'well', 'last', 'time', 'tell', 'line', 'obviously', 'true']"
85,Ses05F_impro01_M021 [163.3500-167.6700]: I don't know who told you that but they were wrong.,3.716666666666667,6.0633333333333335,4.223333333333333,negative,4.667777777777778,3 out of 3,"['neg-know', 'neg-tell', 'wrong']","['know', 'tell', 'wrong']"
86,I'm sorry.,4.81,4.62,5.65,neutral,5.026666666666666,1 out of 1,['sorry'],['sorry']
87,Ses05F_impro01_F021 [167.2500-169.3800]: Do you have a manager I could speak with?,5.365,4.17,6.525,neutral,5.353333333333334,2 out of 3,"['manager', 'speak']","['manager', 'could', 'speak']"
88,Ses05F_impro01_M022 [168.5900-170.8100]: I am the manager.,4.82,4.15,7.16,neutral,5.376666666666668,1 out of 1,['manager'],['manager']
89,Ses05F_impro01_F022 [171.7100-174.1300]: Are you being straight with me?,nan,nan,nan,nan,nan,0,nan,['straight']
90,"Ses05F_impro01_M023 [173.5200-179.8400]: I'm being very straight with you, ma'am.",nan,nan,nan,nan,nan,0,nan,['straight']
91,There is nothing I can do for you.,nan,nan,nan,nan,nan,0,nan,['nothing']
92,You need to stand in line two A.,5.46,3.335,5.2225,neutral,4.6725,4 out of 4,"['need', 'stand', 'line', 'two']","['need', 'stand', 'line', 'two']"
93,Ses05F_impro01_F023 [179.5200-181.6059]: Fine.,6.5,3.86,5.78,positive,5.38,1 out of 1,['fine'],['fine']
94,Ses05F_impro01_M024 [181.2400-184.6200]: Thank you very much.,7.77,3.33,6.89,positive,5.996666666666666,1 out of 2,['thank'],"['thank', 'much']"
95,You have a wonderful day.,6.885,4.095000000000001,6.390000000000001,positive,5.79,2 out of 2,"['wonderful', 'day']","['wonderful', 'day']"
